{
  "$schema": "./docs-protocol-policy-v2.schema.json",
  "schema_version": 3,
  "snapshot_revision": "2026-09-16.1",
  "observed_at": "2026-09-16",
  "organization": "agent-teams-ai",
  "inventory_snapshot_revision": "2026-09-16.1",
  "continuous_audit": false,
  "protocol": {
    "package": "@agent-teams/docs-protocol",
    "producer_repository": "agent-teams-ai/engineering-foundation",
    "producer_is_consumer": false,
    "version_policy": "exact_registry_version",
    "fixed_gate_command": "pnpm docs:protocol:check",
    "reusable_workflow": ".github/workflows/docs-protocol-check.yml",
    "validation_contexts": {
      "trusted_authorization": {
        "id_token": "write",
        "executes_repository_code": false,
        "verifies": ["oidc_workflow_identity", "exact_head", "managed_projection_schema", "managed_projection_digests", "authorized_path_existence", "v2_qualification_contract_structure"]
      },
      "trusted_structural": {
        "id_token": "none",
        "executes_repository_code": false,
        "verifies": ["authorization_digest", "exact_checkout_bytes", "stable_controller_snapshot"]
      },
      "untrusted_repository_qualification": {
        "id_token": "none",
        "executes_repository_code": true,
        "qualification_cli_owner": "@agent-teams/docs-protocol",
        "qualification_command": "agent-teams-docs qualify --consumer . --integration <integration-path> --json",
        "receipt_verification": "released-cohort receipt digest and evidence bound to exact checkout SHA and Cohort",
        "semantic_gate_command": "pnpm docs:protocol:check"
      }
    }
  },
  "admission": {
    "expected_repository_count": 11,
    "owned_repository_count": 11,
    "external_repository_count": 0,
    "fork_source_count": 0,
    "new_owned_repository_status": "pending_classification",
    "qualification_evidence_required": true,
    "live_drift_audit": {
      "status": "bounded_ci_observer",
      "required_credential": "dedicated_read_only_org_inventory_credential",
      "workflow": ".github/workflows/organization-inventory-drift.yml",
      "max_pages": 10,
      "stable_reads": 2,
      "forbidden_credentials": [
        "CODEX_AUTH_JSON",
        "REVIEWROUTER_CODEX_AUTH_JSON",
        "interactive_user_gh_token"
      ]
    }
  },
  "repositories": [
    {
      "repository": "agent-teams-ai/.github",
      "repository_id": 1316243981,
      "source_provenance": { "kind": "original", "parent_repository": null },
      "governance_ownership": "organization_owned",
      "repository_lifecycle": "active",
      "docs_role": "governance_controller",
      "protocol_required": false,
      "admission_status": "not_applicable",
      "exact_package_version": null,
      "exact_foundation_version": null,
      "cohort_binding_status": "not_applicable",
      "desired_cohort_id": null,
      "observed_cohort_id": null,
      "observed_cohort_record_digest": null,
      "observed_cohort_event_digest": null,
      "profile_path": null,
      "caller_workflow_path": null,
      "reusable_workflow_revision": null,
      "qualification_evidence_path": null,
      "fixed_gate_command": null,
      "required_check_context": null,
      "observed_default_branch_evidence": null,
      "qualification": {
        "status": "not_applicable",
        "observed_revision": null,
        "evidence_paths": []
      },
      "exemption": null,
      "required_check_exception_id": null
    },
    {
      "repository": "agent-teams-ai/agent-architecture-standard", "repository_id": 1347745359,
      "source_provenance": { "kind": "original", "parent_repository": null }, "governance_ownership": "organization_owned", "repository_lifecycle": "active",
      "docs_role": "pending_classification", "protocol_required": false, "admission_status": "pending_classification",
      "exact_package_version": null, "exact_foundation_version": null, "cohort_binding_status": "not_applicable", "desired_cohort_id": null, "observed_cohort_id": null,
      "observed_cohort_record_digest": null, "observed_cohort_event_digest": null, "profile_path": null, "caller_workflow_path": null, "reusable_workflow_revision": null,
      "qualification_evidence_path": null, "fixed_gate_command": null, "required_check_context": null, "observed_default_branch_evidence": null,
      "qualification": { "status": "not_applicable", "observed_revision": null, "evidence_paths": [] },
      "classification_evidence": { "decision": "pending_authority_decision", "observed_revision": "535ca76726da0db6eaac3c0eee98ff68fe34befe", "evidence_paths": ["SOURCE.md", "spec/core.md", "spec/governance.md"], "rationale": "The neutral normative documentation boundary needs an explicit authority decision before organization-specific documentation protocol adoption.", "v2_qualification_coordinates": null },
      "exemption": null, "required_check_exception_id": null
    },
    {
      "repository": "agent-teams-ai/agent-runtime",
      "repository_id": 1314129620,
      "source_provenance": {
        "kind": "original",
        "parent_repository": null
      },
      "governance_ownership": "organization_owned",
      "repository_lifecycle": "active",
      "docs_role": "consumer",
      "protocol_required": true,
      "admission_status": "admitted",
      "exact_package_version": "0.6.2",
      "exact_foundation_version": "1.7.2",
      "cohort_binding_status": "bound",
      "desired_cohort_id": "docs-2026-10-03-stable31",
      "desired_cohort_generation": 2,
      "v3_qualification_coordinates": {
        "profile_schema_version": 3,
        "cohort_schema_version": 2,
        "managed_state_schema_version": 2,
        "receipt_schema_version": 3,
        "execution_envelope_schema_version": 1,
        "evidence_class": "cohort-v2-supporting-canary"
      },
      "observed_cohort_id": "docs-2026-10-03-stable31",
      "observed_cohort_generation": 2,
      "exact_cohort_v2_packages": {
        "repository_mutation": "0.2.2",
        "document_authoring": "0.3.2",
        "docs_protocol": "0.6.2",
        "docs_protocol_agent_teams": "0.3.2",
        "engineering_foundation": "1.7.2"
      },
      "observed_cohort_record_digest": "sha256:15ef4d89c312593f5ecee9e0c9890f4ffa487e4d869682dec688460f2f4fc0c8",
      "observed_cohort_event_digest": "sha256:7273eab4e9b555bde22a2c89f4b98735c0d668afb6144b5983e030ee942c420f",
      "profile_path": "architecture/foundation/docs-protocol.yaml",
      "caller_workflow_path": ".github/workflows/docs-protocol.yml",
      "reusable_workflow_revision": "b30455e32cf5d54ade6d8301637701347e4ce57c",
      "qualification_evidence_path": "architecture/foundation/docs-protocol-qualification.json",
      "fixed_gate_command": "pnpm docs:protocol:check",
      "required_check_context": "docs-protocol / docs-protocol-check",
      "observed_default_branch_evidence": {
        "required_context": "docs-protocol / docs-protocol-check",
        "integration_id": 15368,
        "conclusion": "success",
        "check_run_id": 111200715313,
        "check_run_url": "https://github.com/agent-teams-ai/agent-runtime/actions/runs/37122206464/job/111200715313",
        "workflow_run_id": 37122206464,
        "workflow_id": 335216823,
        "caller_workflow_path": ".github/workflows/docs-protocol.yml",
        "caller_workflow_digest": "sha256:27d2ec2d28219b5d0a3aeaf2bf45480694ea317003799e9e43c04f8d3b73d8b7",
        "default_branch": "main",
        "revision": "b81ef94a35fb1fc70a35ddea6f0c61f567dc653e",
        "observed_at": "2026-10-03T12:27:27.492Z"
      },
      "qualification": {
        "status": "qualified",
        "observed_revision": "b81ef94a35fb1fc70a35ddea6f0c61f567dc653e",
        "evidence_paths": [
          "package.json",
          "architecture/foundation/docs-protocol.yaml",
          ".github/workflows/docs-protocol.yml",
          "architecture/foundation/docs-protocol-qualification.json",
          "architecture/foundation/docs-consumer-integration.json",
          "architecture/foundation/docs-protocol-managed-state.json"
        ]
      },
      "exemption": null,
      "required_check_exception_id": null
    },
    {
      "repository": "agent-teams-ai/agent-teams-token", "repository_id": 1348461381,
      "source_provenance": { "kind": "original", "parent_repository": null }, "governance_ownership": "organization_owned", "repository_lifecycle": "active",
      "docs_role": "consumer", "protocol_required": true, "admission_status": "admitted",
      "exact_package_version": "0.6.2", "exact_foundation_version": "1.7.2", "cohort_binding_status": "bound", "desired_cohort_id": "docs-2026-10-03-stable31", "desired_cohort_generation": 2,
      "v3_qualification_coordinates": { "profile_schema_version": 3, "cohort_schema_version": 2, "managed_state_schema_version": 2, "receipt_schema_version": 3, "execution_envelope_schema_version": 1, "evidence_class": "cohort-v2-supporting-canary" },
      "observed_cohort_id": "docs-2026-10-03-stable31", "observed_cohort_generation": 2,
      "exact_cohort_v2_packages": { "repository_mutation": "0.2.2", "document_authoring": "0.3.2", "docs_protocol": "0.6.2", "docs_protocol_agent_teams": "0.3.2", "engineering_foundation": "1.7.2" },
      "observed_cohort_record_digest": "sha256:15ef4d89c312593f5ecee9e0c9890f4ffa487e4d869682dec688460f2f4fc0c8", "observed_cohort_event_digest": "sha256:7273eab4e9b555bde22a2c89f4b98735c0d668afb6144b5983e030ee942c420f", "profile_path": "architecture/foundation/docs-protocol.yaml", "caller_workflow_path": ".github/workflows/docs-protocol.yml", "reusable_workflow_revision": "b30455e32cf5d54ade6d8301637701347e4ce57c",
      "qualification_evidence_path": "architecture/foundation/docs-protocol-qualification.json", "fixed_gate_command": "pnpm docs:protocol:check", "required_check_context": "docs-protocol / docs-protocol-check",
      "observed_default_branch_evidence": {